{"$schema":"https://hanriverflow.github.io/rate-gap/schema/data.schema.json","as_of_date":"2026-10-28","brief":{"as_of_date":"2026-10-19","checks":{"all_changes":[{"baseline_date":"2026-01-02","category":"government","change_bp":95.09999999999997,"current_value":3.877,"is_exception":true,"label":"국고 3Y 수준","latest_date":"2026-10-19","period":"year_start","series_key":"government-3y"},{"baseline_date":"2026-09-18","category":"government","change_bp":-15.000000000000036,"current_value":3.877,"is_exception":true,"label":"국고 3Y 수준","latest_date":"2026-10-19","period":"month","series_key":"government-3y"},{"baseline_date":"2026-01-02","category":"spread","change_bp":12.800000000000056,"current_value":0.2940000000000005,"is_exception":false,"label":"산금채 3Y − 국고 3Y","latest_date":"2026-10-19","period":"year_start","series_key":"kdb-spread-3y"},{"baseline_date":"2026-01-02","category":"spread","change_bp":4.499999999999993,"current_value":0.3819999999999997,"is_exception":false,"label":"회사채 AA- 3Y − 산금채 3Y","latest_date":"2026-10-19","period":"year_start","series_key":"credit-spread-aa-minus"},{"baseline_date":"2026-10-16","category":"government","change_bp":4.1999999999999815,"current_value":3.877,"is_exception":false,"label":"국고 3Y 수준","latest_date":"2026-10-19","period":"previous","series_key":"government-3y"},{"baseline_date":"2026-10-12","category":"government","change_bp":-4.100000000000037,"current_value":3.877,"is_exception":false,"label":"국고 3Y 수준","latest_date":"2026-10-19","period":"week","series_key":"government-3y"},{"baseline_date":"2026-09-18","category":"spread","change_bp":3.8000000000000256,"current_value":0.2940000000000005,"is_exception":false,"label":"산금채 3Y − 국고 3Y","latest_date":"2026-10-19","period":"month","series_key":"kdb-spread-3y"},{"baseline_date":"2026-09-18","category":"spread","change_bp":-2.59999999999998,"current_value":0.3819999999999997,"is_exception":false,"label":"회사채 AA- 3Y − 산금채 3Y","latest_date":"2026-10-19","period":"month","series_key":"credit-spread-aa-minus"},{"baseline_date":"2026-10-12","category":"spread","change_bp":1.4000000000000234,"current_value":0.2940000000000005,"is_exception":false,"label":"산금채 3Y − 국고 3Y","latest_date":"2026-10-19","period":"week","series_key":"kdb-spread-3y"},{"baseline_date":"2026-10-12","category":"spread","change_bp":-0.8000000000000007,"current_value":0.3819999999999997,"is_exception":false,"label":"회사채 AA- 3Y − 산금채 3Y","latest_date":"2026-10-19","period":"week","series_key":"credit-spread-aa-minus"},{"baseline_date":"2026-10-16","category":"spread","change_bp":-0.19999999999997797,"current_value":0.3819999999999997,"is_exception":false,"label":"회사채 AA- 3Y − 산금채 3Y","latest_date":"2026-10-19","period":"previous","series_key":"credit-spread-aa-minus"},{"baseline_date":"2026-10-16","category":"spread","change_bp":0.1000000000000334,"current_value":0.2940000000000005,"is_exception":false,"label":"산금채 3Y − 국고 3Y","latest_date":"2026-10-19","period":"previous","series_key":"kdb-spread-3y"}],"as_of_date":"2026-10-19","exceptions":[{"baseline_date":"2026-01-02","category":"government","change_bp":95.09999999999997,"current_value":3.877,"is_exception":true,"label":"국고 3Y 수준","latest_date":"2026-10-19","period":"year_start","series_key":"government-3y"},{"baseline_date":"2026-09-18","category":"government","change_bp":-15.000000000000036,"current_value":3.877,"is_exception":true,"label":"국고 3Y 수준","latest_date":"2026-10-19","period":"month","series_key":"government-3y"}],"latest_dates_differ":false,"unavailable_changes":[]},"disclaimer":"민평 기준 참고 지표","funding":{"as_of_date":"2026-10-19","funding_rate_percent":4.171,"government_rate_percent":3.877,"percentile_1y":{"n":245,"rank":100},"percentile_full":{"n":732,"rank":92},"spread_bp":29.4,"unavailable_reason":null},"groups":[{"as_of_date":"2026-10-19","key":"corporate_3y","label":"회사채 3Y − 산금채 3Y","rows":[{"as_of_date":"2026-10-19","gap_bp":38.2,"grade":"AA-","month":{"as_of_date":"2026-10-19","baseline_date":"2026-09-18","change_bp":-2.6,"funding_spread_change_bp":3.8,"main_factor":"산금채 스프레드","market_spread_change_bp":1.2},"percentile_1y":{"n":245,"rank":45},"percentile_full":{"n":732,"rank":41},"series_key":"회사채3년(AA-)","unavailable_reason":null},{"as_of_date":"2026-10-19","gap_bp":76.7,"grade":"A+","month":{"as_of_date":"2026-10-19","baseline_date":"2026-09-18","change_bp":-2.7,"funding_spread_change_bp":3.8,"main_factor":"산금채 스프레드","market_spread_change_bp":1.1},"percentile_1y":{"n":245,"rank":46},"percentile_full":{"n":732,"rank":55},"series_key":"회사채3년(A+)","unavailable_reason":null},{"as_of_date":"2026-10-19","gap_bp":103.9,"grade":"A0","month":{"as_of_date":"2026-10-19","baseline_date":"2026-09-18","change_bp":-2.7,"funding_spread_change_bp":3.8,"main_factor":"산금채 스프레드","market_spread_change_bp":1.1},"percentile_1y":{"n":245,"rank":46},"percentile_full":{"n":732,"rank":57},"series_key":"회사채3년(A0)","unavailable_reason":null},{"as_of_date":"2026-10-19","gap_bp":149.5,"grade":"A-","month":{"as_of_date":"2026-10-19","baseline_date":"2026-09-18","change_bp":-2.7,"funding_spread_change_bp":3.8,"main_factor":"산금채 스프레드","market_spread_change_bp":1.1},"percentile_1y":{"n":245,"rank":46},"percentile_full":{"n":732,"rank":58},"series_key":"회사채3년(A-)","unavailable_reason":null}],"summary":{"as_of_date":"2026-10-19","available_rows":4,"baseline_date":"2026-09-18","direction":"전 등급 동반 축소","funding_spread_change_bp":3.8,"main_factor":"산금채 스프레드","market_spread_change_bp":1.1},"summary_unavailable_reason":null},{"as_of_date":"2026-10-19","key":"financial_5y","label":"금융채Ⅱ 5Y − 산금채 5Y","rows":[{"as_of_date":"2026-10-19","gap_bp":43.7,"grade":"AA-","month":{"as_of_date":"2026-10-19","baseline_date":"2026-09-18","change_bp":3.3,"funding_spread_change_bp":0.2,"main_factor":"시장 스프레드","market_spread_change_bp":3.5},"percentile_1y":{"n":245,"rank":62},"percentile_full":{"n":732,"rank":21},"series_key":"금융채Ⅱ(금융기관채) 무보증 5년(AA-)","unavailable_reason":null},{"as_of_date":"2026-10-19","gap_bp":155.8,"grade":"A+","month":{"as_of_date":"2026-10-19","baseline_date":"2026-09-18","change_bp":2.1,"funding_spread_change_bp":0.2,"main_factor":"시장 스프레드","market_spread_change_bp":2.3},"percentile_1y":{"n":245,"rank":40},"percentile_full":{"n":732,"rank":14},"series_key":"금융채Ⅱ(금융기관채) 무보증 5년(A+)","unavailable_reason":null},{"as_of_date":"2026-10-19","gap_bp":221.8,"grade":"A0","month":{"as_of_date":"2026-10-19","baseline_date":"2026-09-18","change_bp":2.0,"funding_spread_change_bp":0.2,"main_factor":"시장 스프레드","market_spread_change_bp":2.2},"percentile_1y":{"n":245,"rank":42},"percentile_full":{"n":732,"rank":14},"series_key":"금융채Ⅱ(금융기관채) 무보증 5년(A0)","unavailable_reason":null},{"as_of_date":"2026-10-19","gap_bp":286.7,"grade":"A-","month":{"as_of_date":"2026-10-19","baseline_date":"2026-09-18","change_bp":2.0,"funding_spread_change_bp":0.2,"main_factor":"시장 스프레드","market_spread_change_bp":2.2},"percentile_1y":{"n":245,"rank":42},"percentile_full":{"n":732,"rank":14},"series_key":"금융채Ⅱ(금융기관채) 무보증 5년(A-)","unavailable_reason":null}],"summary":{"as_of_date":"2026-10-19","available_rows":4,"baseline_date":"2026-09-18","direction":"전 등급 동반 확대","funding_spread_change_bp":0.2,"main_factor":"시장 스프레드","market_spread_change_bp":2.6},"summary_unavailable_reason":null}],"summary_sentence":"산금−국고 29.4bp(3년 백분위 92). 회사채 3Y 금리 gap은 1개월간 전 등급 동반 축소, 주 요인 산금채 스프레드(산금채 +3.8bp · 시장 평균 +1.1bp). 금융채Ⅱ 5Y 금리 gap은 1개월간 전 등급 동반 확대, 주 요인 시장 스프레드(산금채 +0.2bp · 시장 평균 +2.6bp)."},"calendar":{"closures":["2025-01-01","2025-01-27","2025-01-28","2025-01-29","2025-01-30","2025-03-03","2025-05-01","2025-05-05","2025-05-06","2025-06-03","2025-06-06","2025-08-15","2025-10-03","2025-10-06","2025-10-07","2025-10-08","2025-10-09","2025-12-25","2026-01-01","2026-02-16","2026-02-17","2026-02-18","2026-03-02","2026-05-01","2026-05-05","2026-05-25","2026-06-03","2026-07-17","2026-08-15","2026-08-17","2026-09-24","2026-09-25","2026-09-26","2026-10-03","2026-10-05","2026-10-09","2026-12-25"],"timezone":"Asia/Seoul","verified_from":"2025-01-01","verified_through":"2026-12-31"},"data_sha256":"c8ba3c502b37af98d50bc73bbc8bee8f82193870f67e4259fc3d01db48868344","date_basis":"시리즈별 최신 관측값 기준 · 날짜는 서로 다를 수 있으며 결측 금리는 null로 표시합니다. as_of_date·oldest_observation_date는 한국 달력 시리즈(KDB·KOFIA) 기준이며 us_close_date 행은 제외합니다.","disclaimer":"민평 기준 참고 지표","evaluated_date":"2026-10-19","kdb_provisional":null,"matrix":{"as_of_date":"2026-10-19","cells":[{"as_of_date":"2026-10-19","collection_warning":"선택 시리즈 최신 수집 미완료 · 각 칸의 평가일과 결측 사유를 확인하세요. 선택 시리즈 과거 이력 수집 미완료 · 백분위 표본 수와 차트 결측을 확인하세요.","family":"corporate","gap_bp":16.5,"grade":"AAA","history_complete":true,"id":"corporate-AAA-1","month":{"as_of_date":"2026-10-19","baseline_date":"2026-09-18","change_bp":4.5,"funding_spread_change_bp":8.3,"main_factor":"시장 스프레드","market_spread_change_bp":12.8},"percentile_1y":{"n":245,"rank":52},"percentile_full":{"n":732,"rank":76},"percentile_unavailable_reason":null,"provenance":"source","reason_code":null,"sample_end_date":"2026-10-19","sample_is_short":false,"sample_n":732,"sample_start_date":"2023-10-19","series_key":"회사채1년(AAA)","tenor":1,"unavailable_reason":null},{"as_of_date":"2026-10-19","collection_warning":"선택 시리즈 최신 수집 미완료 · 각 칸의 평가일과 결측 사유를 확인하세요. 선택 시리즈 과거 이력 수집 미완료 · 백분위 표본 수와 차트 결측을 확인하세요.","family":"corporate","gap_bp":21.1,"grade":"AAA","history_complete":true,"id":"corporate-AAA-2","month":{"as_of_date":"2026-10-19","baseline_date":"2026-09-18","change_bp":-3.7,"funding_spread_change_bp":4.3,"main_factor":"산금채 스프레드","market_spread_change_bp":0.6},"percentile_1y":{"n":245,"rank":41},"percentile_full":{"n":732,"rank":70},"percentile_unavailable_reason":null,"provenance":"source","reason_code":null,"sample_end_date":"2026-10-19","sample_is_short":false,"sample_n":732,"sample_start_date":"2023-10-19","series_key":"회사채2년(AAA)","tenor":2,"unavailable_reason":null},{"as_of_date":"2026-10-19","collection_warning":"선택 시리즈 최신 수집 미완료 · 각 칸의 평가일과 결측 사유를 확인하세요. 선택 시리즈 과거 이력 수집 미완료 · 백분위 표본 수와 차트 결측을 확인하세요."